Tweet,Target,Stance
imagining thing gotten like 10 union endorsement last couple day,Bernie Sanders,1
sander completely disingenuous approach democratic party unlike say jesse jackson ran raise awareness issue backed hurt eventual candidate sander dug enhance brand regardless damage nominee,Bernie Sanders,0
warren sander overlap many level yet endorsement intention even want advance political agenda election2020,Bernie Sanders,1
bernie win ballot bring progressive party ridiculous worried someone true democrat people important political party firstjewishpresident,Bernie Sanders,1
candidate delegate win everyone bernie demdebate2020 berniesanders,Bernie Sanders,0
followed laugh stupid misinformed tweet look forward full meltdown mode tweet berniesanders eventually drop,Bernie Sanders,0
none democrat would able get anything done moscow mitch need mobilize people bernie leading movement working people bring people together real change happens thank,Bernie Sanders,1
get motivated go sander right going bad real bad american whole planet michiganforbernie notimelikethepresent,Bernie Sanders,1
sander went soviet union honeymoon guess niagarafalls hawaii cut,Bernie Sanders,0
obama conservative always always said anyone wanted listen llatest reveal bernie winning nomi obama would speak stop surprise one would speak stop bloomberg frm,Bernie Sanders,1
excellent thread literally summed issue warren think extremely weak especially area american people would need support plus come war like sander bernieorgreen,Bernie Sanders,0
2020 looking bleak berniesanders 2020election campaign giving every socialist massive lift reason optimistic although sure plan hatched stop prepare inevitable,Bernie Sanders,1
wake people one symptom unbridled greed know sander dropped butneither major party supporting american people crisis listen bernie2020 let u beg reconsider,Bernie Sanders,1
idea bernie right taking million pool money liked minded citizen amp start chain store named bernmart would put walmart business time economic wizardry,Bernie Sanders,0
american people understand people call berniesanders honest oh wait supporter hungry free stuff expense others liar allpoliticiansareshittyliars writeinbernie,Bernie Sanders,0
stop wasting everyone time stupid poll include front runner bernie,Bernie Sanders,1
lol denmark trending denmark democratic socialist country socialist country learn difference berniesanders,Bernie Sanders,0
75 year fdr proposed economic bill right must take unfinished business new deal carry completion berniesanders,Bernie Sanders,1
bernie barnstorm event iedsa member community discussed organize help get bernie elected u proudly endorse bernie hosting debate watch party thursday ibew local 47 430 dsaforbernie bernie,Bernie Sanders,1
vote third party green party however bernie candidate id vote dem anyone else id probably vote green,Bernie Sanders,1
yesterday miami democratic campaign consultant lobbyist evan ross compared david duke miami dems demanded retract comment want thank strong rebuke notmeus story,Bernie Sanders,1
finally opportunity elect someone honest owned senator sander rare gift know american need berniesandersforpresident,Bernie Sanders,1
us party fill bank account nobernie democrats2020,Bernie Sanders,0
love hearing shouting sunrise movement demdebate love even demonstrates leadership necessary enact greennewdeal enact,Bernie Sanders,1
respectfully disagree mimi corporate medium medium going ignore time,Bernie Sanders,1
let u hope racist deflate support imperialist berniesanders,Bernie Sanders,0
