Tweet,Target,Stance
due confusion caused coronavirus able vote bernie nearly 50 time getting tired deciding take quick lunch break plan going back voting many time polling place close suggest try,Bernie Sanders,0
bernie sounded great npr today mad campaign folk even agree sign letter support union counselor support military member insurance company boss steal taxpayer dollar working people huh,Bernie Sanders,1
reason iowa may well berniesanders ultimately bernie win end sander cuck dnc past behaviour indicative future behaviour clownworld,Bernie Sanders,0
see thread insulting normally telling like certainly feel free jump berniesanders suddenly attacking started election2020,Bernie Sanders,0
follow bernie peril college europe free catch r taxed almost 50 earningsthat 12 paycheck nextthey far le people going collegebernie tell truth health care vote wisely vote republican,Bernie Sanders,0
still wishing miracle elizabethwarren could run vp bernie going sure win democrat get racistpresident white house,Bernie Sanders,1
sander people always lying covering dems much better bernie need release newest health record stop gaslighting demdebate berniesanders,Bernie Sanders,0
berniethe truck driver lost job automation would offered free collegevocational training job choose help start business etc long record current policy prove would forcedlaborlack freedom,Bernie Sanders,1
iendorsebernie ton reason one number 1 running time save planet worst climate change need bernies greennewdeal bernie indiana,Bernie Sanders,1
beat make bull hope stick bernie,Bernie Sanders,0
bernieyellsforus bernieyellsforme berniesanders democrat whatever defeat bernie sander like 2016 nothing like 2016,Bernie Sanders,1
donated first campaign lot give bernie give hope future fundamentally change america believe,Bernie Sanders,1
minivan app extremely useful canvassing walk whole process anyone canvassed encourage fun fulfilling going win peoplepower bernie,Bernie Sanders,1
attack oh waityou mean people want noncitizen voting mean votingrights neverkamala electoralcollege 2020election election2020 epicfail govote walkawayfromdemocrats bernie,Bernie Sanders,0
berniesanders get beat democraticparty everything power harm 2016nominee run ticket ever period life long member democraticparty know put dnc pay attention,Bernie Sanders,0
lot photo ops homestead cap betting bernie photo op guy wonder he addressing concern behind scene,Bernie Sanders,1
easy believe thinking past year seems andrew gillum come support sander help put 400000 new voter ballot felon definitely radical enough know dnc,Bernie Sanders,1
going lie page first learned read found people wake eventually power shit fraud theft come end bernie swamp drained real,Bernie Sanders,1
fight inspire u join together transform country justiceforall realleader bernie,Bernie Sanders,0
corporate democrat either disabled sole provider child international centrist belief social reform including limited universal healthcare living wage false bernie attacking amp votebluenomatterwho,Bernie Sanders,1
bernie direct threat health misguided giveaway,Bernie Sanders,0
seems like centrist democrat loyalist inspired metoo movement ability take many personality since 2016 thought would preemptively try bernie 2020,Bernie Sanders,1
many time bernie thrown woman zephyr teachout woman color bri nina notmeus movement bus partly understood old black folk w see,Bernie Sanders,0
affordable healthcare basic human right ridiculous medicare4all require pay time service pay tax affordable healthcare4all go together stand anything le m4a bernie,Bernie Sanders,1
wallstreetpete running plan relies bringing back individual mandate amp taxing people could afford keep insurance retroactively medicareforall fraction cost amp let u go dr want bernie,Bernie Sanders,1
jess gave almost 200 million bernie 2020 doubt berniesanders pas small business real agenda socialism,Bernie Sanders,0
help saying public option available required getting slammed bernie supporter including infamous shhhh timblack misunderstanding,Bernie Sanders,0
china run california 24hr chicom camera watch get people leaving home communistcalifornia bernie supporter get glimpse life want freedom gone thursdaymotivation stimulusbill gov moneystay home,Bernie Sanders,0
vague fact require belief religion candidate id love know voter bernie proposal he fought consistently way 2016 amp voted accordingly unlike anyone else running,Bernie Sanders,1
bernie alot need tune answershe losing answer place clear better,Bernie Sanders,0
speak parent wife hiring usual goto 16 year old babysitter precinct captain bernie iacaucus night second choice take u see participatory direct democracy action,Bernie Sanders,1
going church denied also would honor warren2020 berniesanders,Bernie Sanders,1
breaking bernie sander utah 3rd victory super tuesday also carried state 2016 diplomacy140,Bernie Sanders,0
wapo bernie sander fact polling show bernie highest favorability among voter msm trying screw bernie shock considering bezos owns wapo nomiddleground,Bernie Sanders,1
first heard excited comb video see article missed issue comprehensively affect every aspect shared human experience u mic foreignpolicymatters vote like tulsi2020 bernie,Bernie Sanders,1
bernies zionist hardcore base make least acknowledge misery palestinian,Bernie Sanders,0
want keep job fix election know rigged first tom perez must goand bernie president news station air result primary even happen yet primarypelosi berniewon,Bernie Sanders,1
bernie sketch weekend story instagram berniesanders,Bernie Sanders,1
voting bernie independent would defeat purpose bluetsunami2018 democratic else republican likely retain position,Bernie Sanders,1
hillary campaign dnc cnn colluded bernie sander proven dnc server hacked memo released public,Bernie Sanders,1
bernie sander campaign democrat arrested nine different time bernie sander article published july 15 201800pm,Bernie Sanders,0
hey sara_pal thanks follow votebymailforbernie downballot progressive state dem primary find demexit,Bernie Sanders,1
never seen someone completely wrong twitter extreme length 21 tweet nothing true congratulation must new twitter record runbernierun berniesanders,Bernie Sanders,0
maybe bernie old realize kid nowadays informed thanks social medium handsoffvenezuela,Bernie Sanders,0
yes back mainstream medium attack smear mock denigrate u movement american people deserve better medium journalist period berniesanders,Bernie Sanders,0
salty af bernie came tweet indignant democratic socialistsnaw prove point nuthin,Bernie Sanders,1
whether commenters agree point awesome thing movement bernie started amp amazing policy notmeus talking amp sharing idea solve problem affordable housing amp homelessness win amp transform country,Bernie Sanders,1
view victim sympathy certain skin color religious cult give exempt status criticism get jail free card action criminal onthetake bernie greed deadly sin,Bernie Sanders,0
bernie continues try take democratic party okay,Bernie Sanders,0
hillary good enough bernie crowd thought 4 year saint would front runner hillary destroyed,Bernie Sanders,0
need report berniesanders proving liberal may shit nest goodness justice voteredtosaveamerica,Bernie Sanders,0
know many democrat r running office want win get keep money raised right bernie like get rich quick scam right kamalaharris kamala2020 another way 2 top besides raping old men,Bernie Sanders,1
berniesanders supporter fake rape strategy encouraging people tweet slur genuine survivor basis ried lie support idea ford lying even metoo proponent telling stop,Bernie Sanders,0
yous legislative accomplishment democrat announced 2020 potus candidate andgo sanders0 harris0 warren0 booker0 gillibrand0,Bernie Sanders,0
2016 3m people lose job one week million suddenly need health care inarguable clear berniesanders policy suddenly benefit much larger number people greennewdeal way depression,Bernie Sanders,1
shaking hand mr buhari president nigeria wash hand,Bernie Sanders,0
appreciate bernie fired every answer cuz debate boring fuck lmao democraticdebate,Bernie Sanders,1
stop frisk mike bloomberg one time republican mayor one first thing eliminate nycs recycling program forced rethink idiotic billionaire instinct great bernie support dc becoming 51st state,Bernie Sanders,1
supporting speaking straight truth corrupt dnc bought billionaire republican bloomberg,Bernie Sanders,1
sake climate sick homeless indebted berniesanders,Bernie Sanders,1
happy finally got long food line he fond dropoutbernie democraticprimary,Bernie Sanders,0
bernie sander listens leader tired leader dictate u ideal ideal sander hears say policy based upon input system broken fix,Bernie Sanders,1
assure without astroturfing bernies union support probably strongest versatile support candidate many even vote primary based people met hillary going win anyway,Bernie Sanders,1
bernie liz met year ago private remember bernie manage remove superdelegate rule convention believe knew would cause harm anything berniesanders warrentobernie,Bernie Sanders,1
democrat truly almost need go face pandemic fight people compromise face need even disaster need protection system maintain u medicareforall sickleave bernie,Bernie Sanders,1
guess mean political big pharma donor national security risk bernie president take big pharma money,Bernie Sanders,1
since bernie sander sole purview senate democrat working climate legislation year,Bernie Sanders,1
money ruling uspolitics therefore sander lose matter vote happening right iowa riggedelection iowacaucus2020,Bernie Sanders,0
keep posting pro bernie bullshytethat make story perfectly plausible,Bernie Sanders,0
bernie sander supporter since 2016 white man 25 college degree come wealthy family peoplepoliticians journalist pundit alikeignore favor berniesanders narrative,Bernie Sanders,1
seeing bernie yang supporter competing raise money candidate today say berners,Bernie Sanders,1
berniesanders delusional someone please tell charge,Bernie Sanders,0
one question fcuk bernard sander bernie,Bernie Sanders,0
thread release sweeping plan fundamentally overhaul u labor practice law,Bernie Sanders,1
long recognized commitment 2 liberation transcends bernie camp however sander reminded u okay 2 activate revolutionary imagination struggle always ongoing stop niki franco 25yo miami,Bernie Sanders,1
feel like bernie far left actually wrap around touch hand extreme magas,Bernie Sanders,1
like 2016 virginia bernie every county got zero delegate democracy dead country need cardioversion nomiddleground endoligarchy,Bernie Sanders,1
mean testing waste time enact immediately ubi 2kmo retro march 1 6 month resolution full clean immediate implementation senator sander medicareforall full clean amp immediate implementation worker protection,Bernie Sanders,1
sure bernie really aware disaster going illinois many fleeing yet killing child doping everybody priority awful,Bernie Sanders,1
keep free market capitalist society mr bernie bad hurt feeling united state america ussr chiner kag2020landslidevictory,Bernie Sanders,0
berniesanders lived polled audience amp enthusiasm amp loud strong voice unison people agreed medicareforall fighting climatecrisis 15 minwage amp free public college radical idea 99 want amp need succeed,Bernie Sanders,1
wisconsin michigan indiana 2016 come look closeryeah right front go say b e r n e n e r bernie follow regret get permission corporate bos,Bernie Sanders,1
executivetradingcards one limited edition berniesanders trading card executive trading get shopping ebay store,Bernie Sanders,1
bernie driving dems left agree idea sick dems taking big pharma payday loan money amongst many big money dems kamala harris get said corp money way take back country citizen united corp money,Bernie Sanders,0
nothe american people desire run american people desire run first place chose bernie resist,Bernie Sanders,1
great week bernie supporter richmond exciting event got mostly positive response volunteering see rally thursday arthur ashe athletic center berniesanders richmond virginia,Bernie Sanders,1
watching right take lesson end men done choice left woman berniesanders,Bernie Sanders,1
happened bernie ali velshi show week ago talking important issue light pandemic progressive switch tara reade bernie one fd berniesanders,Bernie Sanders,0
socialism bernie policy failure thing bernie talk thing dictator say ruse mass support quell populist anger real solution,Bernie Sanders,0
know real scumbag even eric foreman like berniesanders,Bernie Sanders,0
feel like point feel identify would feel like created destroyed new zero math authority figure considerate like never bernieorbust2020,Bernie Sanders,0
corruptdnc broker colludes give nomination someone person get delegate vote democrat amp republican lose election independent writein candidate named berniesanders dncrigging bernie,Bernie Sanders,1
sorry tired supply truth receipt prove point urination required bernie old school fdrdemocrat newschool policy proposal,Bernie Sanders,1
avid supporter focusing policy understanding psychology sociology culture leader also important kind speaking kindly matter need backed w policy competent compassionate leader bernie,Bernie Sanders,1
senator berniesanders sarah palin asks proponent gnd support get rid human coalition plan allow killer whale vote southcarolinadebate,Bernie Sanders,1
whenever bernie something say something human right believe,Bernie Sanders,0
going best kansa need real change ole thing medicareforall bernie,Bernie Sanders,1
would sexist pig bernie still able talk allowed move arm demdebate democraticdebate,Bernie Sanders,1
profoundly disappointed dnc liberal bone hell complicated since 2016 sander debacle,Bernie Sanders,0
suggest warren equivalent bernie uniquely positioned amplify part platform represents strategic victory bernie opportunity notmeus movementif claim 3,Bernie Sanders,1
one day berniesanders going come realizationit policy like,Bernie Sanders,0
bradybill proposed waiting period buying gun background check berniesanders voted realize stop every shooting help fence keep mind vote southcarolina supertuesday pete2020 demprimary,Bernie Sanders,0
still v8 vote rapist corrupt inveterate liar actual legend right front ballot get act together mailin vote berniesanders superbernietuesday,Bernie Sanders,1
berniebrunch park today yuuuuggee nevada ready bernie2020 feelthebern notmeus join u,Bernie Sanders,1
mayorpete campaign people amazing love congratulation mr buttigieg chasbuttigieg occupy white house one day right hoping sec state doj dhs ambassador sander administration,Bernie Sanders,1
young people liking comrade bernie really inflated many seriously like trust bernie,Bernie Sanders,0
thou shalt take bernies name vain bernie bro bible democraticdebate,Bernie Sanders,1
bernie went far wanted go extent would damage senate committee assignment detriment democraticpartys leadership,Bernie Sanders,0
screen tell u crazy stupid want functioning healthcare system trying put billionaire military business wonder people becoming paranoid angry medicareforall nomiddleground berniesanders,Bernie Sanders,1
neither offered public comment treatment kiahmorris racist treatment camper stowe made news beyond boundary vt stoking racial tension within vt,Bernie Sanders,0
kerfuffle bernies worker terrible pay prelude happen across country b elected wakeup rule others amp people like want increase downtrodden keep u lineand hell able afford another house,Bernie Sanders,0
independent contractor doordash ubi help way 15 minimum wage would sorry bernie via yanggang election2020 goaxim,Bernie Sanders,0
old guy sound like every pandering facebook post ever substance possibility fulfill wild promise bernie never win democraticdebate2020 democraticdebate,Bernie Sanders,0
ready willing able best thing 2016 fun pounding pavement bernie deep south best done face face let u,Bernie Sanders,1
folk bernie still ballot primary primary state voted please reconsider demexiting cast ballot may able win change direction party bernieontheballot,Bernie Sanders,1
solemn moment agrees citizen issue matter habitable planet,Bernie Sanders,1
cheering tulsi gabbard order force good must good tulsi gabbard truthagainstwar gabbard2020 bernie,Bernie Sanders,1
fight bernie death want contagious socialism german worker win right 28hour working week germany unionpower,Bernie Sanders,0
walk like terrorist talk like terroristmust dems tcot tlot nhpolitics backedbycrazybernie,Bernie Sanders,0
omg might stop looking twitter election bernies supporter brutal election2020,Bernie Sanders,0
dems need head examined even engage idea voting communist berniesanders,Bernie Sanders,0
berniesanders bernie berniesanders lie irresponsible fear put forth leftist hack aoc say world end 12 year democrat party racist identitypolitics racist intersectionalism,Bernie Sanders,0
disgusting parent allowed child fondled right fucking front tactile politics sexual grooming realtime would never vote anyone expendable capacity voting value wearenotexpendable berniesanders,Bernie Sanders,1
giving worker seat corporate board reversing egregious corporate tax cut make sure college student graduate debtfree 2 notmeus progressive taken speech illinois september 7th2018 sound like berniesanders platform,Bernie Sanders,1
know read advocate bernie primary blue general bernie nominee,Bernie Sanders,1
mainstream medium servile corporate interest would literally prefer centrist appalling record people genuinely believe dementia see progressive like berniesanders democratic nominee even though run excellent campaign,Bernie Sanders,1
16 hurt though bernie distancing little mean something comrade laughed know true notmeussr berniesanders,Bernie Sanders,1
first came alex jones everyone cheered targetted outlier ie altright like call altleft ie socialistsberniebros simply disagree oligarchselites ie authoritative source get silenced,Bernie Sanders,1
one thing clear free social program bernie2020 warren2020 democraticsocialism stooge socialism extremely high cost high need invent new taxing program pay,Bernie Sanders,0
terrible look sander team like q came thin air man heart attack last year promised share record democraticdebate,Bernie Sanders,0
thanks showing u side revolution bye nikki bernie46 thepeoplespresident bernie,Bernie Sanders,1
1936 fdr could easily 2020 business amp financial monopoly speculation reckless banking class antagonism sectionalism war profiteering begun consider government yous mere appendage affair,Bernie Sanders,1
probably lot people said heinous shit bernie added like could go many went thought id blocked act surprised,Bernie Sanders,1
yeah berniebro absolutely positive socialist millionaire bernie sander stand absolutely chance winning texas wakeupdemocrats,Bernie Sanders,0
idiot read july 1st summer vacation drank beer weekday night summer please retire,Bernie Sanders,0
hope others support important work st jospeh county greater indiana ourrevolution berniesanders,Bernie Sanders,1
say officially undecided come 2020election initial reaction warren way reminded bernie anticapitalist race thing care greatly need reading amp thinking,Bernie Sanders,1
new sub brother big fan choice coverage amazing keep fighting good fight man together win better world bernie,Bernie Sanders,1
betting bernie biggest donor month ever berniesback magnificent hit would thought something bad could big,Bernie Sanders,1
100 percent right fact put aside hatred wealthy time crisis prof unfit office sick individual bernie,Bernie Sanders,0
much democratic party concern aware u president lead nation party bullying everyone disagrees berniesanders platform progressive culture campaign creating dobetterbernie,Bernie Sanders,0
probably vote green unless new third party bernie nominee assured getting enough ballot win plurality electoral vote likelihood happening anyone,Bernie Sanders,1
voted yet bernie still ballot get deligates convention vote like life depends literally pas,Bernie Sanders,1
eliminate entire student medical debt bernie would know money amp scarcity fake pulled 3t wallst one week nowhere know going pay itis b question people need help never asked bank,Bernie Sanders,1
need democrat pas bill forgives gov debt free spend much want bernie elizabethwarren kamala2020 aoc,Bernie Sanders,1
berniesanders knew literacy important especially anticommunists enabled read death warrant,Bernie Sanders,1
according medium bias fact checker high rating factual reporting sacrificing reputation spread nonsense bernie trending hour twitter feeling bern,Bernie Sanders,1
one ridiculous thing read bernie least amount dirt anyonethis must joke lol,Bernie Sanders,1
voter country done sociopathic powerhungry laissez faire hypocritical insider elitist bullshit move fucking way bernie,Bernie Sanders,1
sander uwanna b pte go 2d soviet union oh ur implode talk 2fidel castro oh sorry dinosaur hell let u see well better review video socialist among u,Bernie Sanders,0
nobody make million let alone billion profit people diagnosed disease condition need medicine bottom line justice sale berniesanders,Bernie Sanders,1
bernie actually diverse support base literal majority female strongest among latino young black,Bernie Sanders,1
thank right side justice history endorsing berniesanders demdebate,Bernie Sanders,1
exactly pull bootstrap work must even playing field berniesanders,Bernie Sanders,1
ghost started thread tweeting ghost worried unlikely event berniesanders boocomes potus another tweet part thread site rabid millennial follower watch boomans like scare ghost,Bernie Sanders,0
people working policy together would donor class bernie,Bernie Sanders,1
better yet run president need distraction thank,Bernie Sanders,0
happened progressive race 3 presidential candidate bernie gravel williamson signed would call basic straightforward progressivepledge,Bernie Sanders,1
berniesanders fucking racist sexist bernie bros must understand american dislike big government,Bernie Sanders,0
berniesanders guaranteed l dems novemberup ticket train wreck democraticparty get also rans bernie actually explain policy he never gotten enacted,Bernie Sanders,0
democraticdebate berniesanders look like trouble paradise liz amp bernie go shake hand refuse look like little tiff democrat attacking one another classic,Bernie Sanders,0
sure hope sander nominee fooled awhile know better remember 2016 believe want woman president,Bernie Sanders,0
trust tulsi slightly better policy pull til end turn country around forget tulsi resigned dnc post support bernie get trustworthy,Bernie Sanders,1
bernie need fuck need unite splinter like bernie amp push uniteblue bluewave voteblue voteblue2018,Bernie Sanders,0
prisoner ostensible right beaten raped tortured etc arguing prisoner given right entirely incarcerated distortionary canada others allow prisoner vote positive effect rehabilitation ultimate goal bernie,Bernie Sanders,0
2016 washington post validated bernie sander high school track record claim doubtful veracity future goal presidential record without taint,Bernie Sanders,1
respect work shaun please stop sinking low place support candidate please stop vilifying another viable candidate acting like berniesanders unbecoming making rethink overall respect activist,Bernie Sanders,0
old mother hunbard went cupboard get poor dog bone got cupboard bare poor dog none moral dog let u mother hubbard run country socialism berniesanders left right u right kag,Bernie Sanders,1
would vote based policy supporter berniesanders fighting american including fighting hope join u fighting corporate socialism 1 desperately need medicare4all,Bernie Sanders,1
facethenation berniesanders said thing amp 30 yr need hear morning bye,Bernie Sanders,0
sander establishment working class hero spent life fighting working family,Bernie Sanders,1
sander democratic socialistsocial democrat socialist marxist communist even running campaigning amp policy represent platform basically 21st century fdr,Bernie Sanders,1
aoc supported failed candidate see excerpt somehow pull campaign israel popular u democratic candidate nevercorbyn cynthianixon tiffanychaban donothingdems bdsfail berniesanders,Bernie Sanders,0
listen word politician speak access something afford mean nothing 2020election berniesanders,Bernie Sanders,1
medicare study mention medicare federalonly program significant portion medicare statefunded federal government would bear entire burden funding increase,Bernie Sanders,1
happy see continue fight nomination looking forward next demdebate,Bernie Sanders,1
ignorant radical leftist taxpayer bribed vote lying commie money sander communist sovietsanders,Bernie Sanders,0
earth bernie trying prove punching bag look like punching bag winning bernie,Bernie Sanders,1
show based woman expressing opinion woman push fake bernie narrative amp erase voice like mine act like victim saying bombarded message u damn rightthey hearing woman like,Bernie Sanders,1
bernie find irritating bernie keep blaming primary loss super delegate even without still behind bigger problem time fewer state caucusing,Bernie Sanders,0
agree one point time bring source please thanks openminded bernie supporter,Bernie Sanders,1
bernie baby melting insanity rule bot gop behind fool want despicable 45 win put away sharp object think 2020 sanderswarren2020,Bernie Sanders,0
feel kamalaharris like person school always strived perfect attendance hung popular group bernie would kid made sure everybody lunch eat access nurse office,Bernie Sanders,1
covid19 show inequality new gilded age healthcare employment coronavirus covid19 bernie,Bernie Sanders,1
