Tweet,Target,Stance
sander got shy 50 primary vote hardly loss democracy last time tried without lost generalelection time win,Bernie Sanders,1
mrpotatohead mrspotatohead endores potus expect president le,Bernie Sanders,0
resister make list follow cry someone block as please block sick tired looking shit help bernie believe blue matter,Bernie Sanders,1
warren surfacing moderate fading bernie really write damn bill talk thing democraticdebate 740a est l e n l v e,Bernie Sanders,1
party claim care middle class democrat sure mind bankrupting alexandriaocasiocortez berniesanders climatechange democrat economics elizabethwarren socialism usnews bernie,Bernie Sanders,0
omg need stop listening whoever advising say crap,Bernie Sanders,0
oldest youngest people board get middle come around greater number mend generational divide bernies plan greatly improve life people age yet come epluribusunum ofmanyone,Bernie Sanders,1
want stop mentioning bernies traitor,Bernie Sanders,0
lol starting think socalled bernie bro trolling,Bernie Sanders,0
endorsed guy told everyone safe vote person couple week ago week candidate notfittolead berniesanders one saying mail ballot stay home,Bernie Sanders,1
mean incredibly disappointing electable socialist 110 want bernie warren proposing simply possible voter allow time,Bernie Sanders,1
something republican would say guy talent get worse everyday think make player equal everyone able sprint entire game berniesanders,Bernie Sanders,1
obama damage control former president ready back whoever win 2020 nominationeven bernie sander sabotaging preemptively ensure happen,Bernie Sanders,1
happy bernie got brain implant go bad self,Bernie Sanders,0
inspire u better people see explained 10 year old perfectly hit feel,Bernie Sanders,1
upstate new york vermont thousand time best place earth shop clean friend live love vermonter literally nicest people bernie,Bernie Sanders,1
going sue exposing corruption mean sue taking away vote bernie demexit,Bernie Sanders,1
sander foxnews karl rove fast narrative bernie sander frontrunner,Bernie Sanders,0
fuck bernie goddamn hypocrite even today ever,Bernie Sanders,0
tell fake like also complete idiot,Bernie Sanders,0
follower laughing attck instead bringing u together attack u keep strong fight back berniesanders,Bernie Sanders,1
manchins douche vote blue matter as someone want remind party mantra yes even bernie manchinsarepublican votehimout,Bernie Sanders,1
yet find democrat explain putin ran bernie race rigged debate asking friend,Bernie Sanders,1
people say bernie point yell snake emojis twitter,Bernie Sanders,1
easier bernie talk socialist talk millionaire,Bernie Sanders,0
hey iowa lest forget dnc coming ensure election fair dnc argued legal obligation provide fair election guard berniesanders,Bernie Sanders,1
bernie hosted medium highdollar closeddoor fundraiser new york los angeles elsewhere previous campaign sure bernie supporter aware bernie yang2020,Bernie Sanders,0
defend purposeful attempt slow economic growth prolong joblessness suppress wage growth however like sag economy today rate hike done first place sander agrees rate sink,Bernie Sanders,1
yes day thinking potus still organizerinchief leveraging powerful notmeus movement ballot race finally let u berners let u get progressive elected sign,Bernie Sanders,1
called ridiculous 2016 angry one berniesanders bernie,Bernie Sanders,1
exactly reactionary reconcile narrative supporter lazy bum work fact decimated competition term campaign fundraising moron think money come,Bernie Sanders,1
ocasiocortez amp better stop fucking democraticparty sander used dems refused become one cortez kissing sarandon say go way allow dems run dems win left center,Bernie Sanders,0
reminded day opeds wrote time ago discussing politician use servicemembers political agenda ie showing optic politician completely ignore demean female servicemembers allowed single sander,Bernie Sanders,1
yes berniesanders warned u thing better policy twice corporate buyout government amp democracy well danger face without healthcare coverage plus ahead without green new deal think,Bernie Sanders,1
love bernie honest decent human unlike politician notmeus fam incredible huge group diverse people fighting message ring true anyone humanity left,Bernie Sanders,1
okay berniesanders fan time stop giving warren attention sadly role clearly shifted causing division among progressive voter since winning anything focus effort beating competitive candidate scprimary,Bernie Sanders,1
sure clip may posted online bernie staff particularly something newsworthy occurs wonder address demdebate2 moment berniemaddow,Bernie Sanders,1
bernie getting latino vote obviously know least friendly candidate toward immigrant latinovote berniesanders berniesanders bernie bernie need explain voting record immigration washington post,Bernie Sanders,0
want access healthcare save demdebate berniesanders democraticdebate,Bernie Sanders,1
everyone please vote organizer chief bernie sander berniesanders,Bernie Sanders,1
demdebate democratic party know capable take away nomination berniesanders even try dnc,Bernie Sanders,1
say left versus thing described amp editor right almost like engaged honest reporting,Bernie Sanders,0
call immediate moratorium eviction foreclosure utility shutoffs well lending small mediumsized business coronaviruspandemic medicareforall solidarity,Bernie Sanders,1
likelyits bernie need drop follower amp extorting election,Bernie Sanders,1
wake hello somebody democraticprimary bernie childrens future vote bernie primary,Bernie Sanders,1
bernie democrat amongst wretched hive scum villainy berniesanders,Bernie Sanders,1
wish never listened consultant amp donor class amp done got course chose listen amp policy line progressive ride nonexistent fence,Bernie Sanders,1
yes need pivot past multimillionare dollar consultant put trust people peopledriven campaign election berniesandersit people fighting economy work u,Bernie Sanders,1
warren gumption say big business industry come talk big end take money big industry mean repay bernie,Bernie Sanders,1
matthew dems tell bernie full could lose 49 state berniesanders chrismatthews democraticprimary,Bernie Sanders,0
phony baloney slumlord war monger peaceful berniecrat nyc district 12 vote democratic primary june 26,Bernie Sanders,1
lie better anything else already one like berniesanders,Bernie Sanders,0
release tax bernie want prove credibility,Bernie Sanders,0
would please reach rest democrat horribly wretched thing saying bernie supporter,Bernie Sanders,1
maga left folk hostile people mention day love fight berniesanders,Bernie Sanders,0
uranium one govt track every gram uranium ore enduse requires every single location moved licensed also hillary never authorized putin purchase controlling interest mine yet bernie never denounced,Bernie Sanders,0
answer life love charter together fight psychopath rule u far right far left agree way disagree want financial liberty maga bernie unite sort difference later,Bernie Sanders,1
berniesanders say want talk issue meanwhile welcome support ostentatious twitter troll cmon dude,Bernie Sanders,0
would ok evil one spending kind money sold got cut,Bernie Sanders,0
fan berniesanders see deck stacked someone via,Bernie Sanders,0
democrat worst fight net neutrality daca dreamer controlling military spending much much votethemout neoliberalssuck justicedemocrats voteprogressive bernie,Bernie Sanders,0
bernie bernie mofoing sander policy tried true already proven work never bought always right,Bernie Sanders,1
going allowed destroy united state even democrat nominee gotohell berniesanders,Bernie Sanders,1
young need medicare take 1000 month life free college day simple math berniesanders andrewyang,Bernie Sanders,0
agree opening gulag mass murder knew impersonator berniesanders,Bernie Sanders,0
happens democrat reason selfcentered divisive multimillionaire independent socialist berniesanders mean bitter man destroyed hillaryclintons opportunity president 2016 neverbernie,Bernie Sanders,0
real folk praising communist dictator ever visited cuba venezuela people eating garbage say socialism berniesanders socialismkills nevadacaucuses nvdemscaucus democrat iberal progressive venezuela cuba,Bernie Sanders,0
dear friend still hope reconstruct right people votebernie berniesanders,Bernie Sanders,1
headline read 15 bernie backer idiot 2nd nominee 15 bernie backer prove democrat lose election right election2020 democrat,Bernie Sanders,0
man walk talk talk conviction talk u follows putting work behind word people reclaim white house bernie,Bernie Sanders,1
nevadacaucus vote medicare look worked vermont tax tripled gullible sander going increase tax,Bernie Sanders,0
democrat hilariously losing starbucks ceo considering running independent ironically people pushing three party system bernie got burned 2016,Bernie Sanders,0
moderate saying bernie supporter saying toxic last year election2020,Bernie Sanders,0
bernie finally getting vetted delinquent dad would thunk,Bernie Sanders,0
remember guy work talking need put conservative gulag remember said oneoff remember released video prove bunch liar fun,Bernie Sanders,0
bernie proposing looking model scandinavian country many european country offer health care right many country consistently show high happiness index,Bernie Sanders,1
watching democratic debate sander get win november support republican like senator warren socialist never,Bernie Sanders,0
bernie insisting staying race path nomination amp mean going state state nightmare scenario holdingpostponing election stop squirming let u forget primary vote generalelection,Bernie Sanders,0
pfizer earned 52 billion revenue 2017 also gave ceo 61 percent raise plan january price hike call business usual taking big pharma greed,Bernie Sanders,1
bullcrap bernie quit spreading hate time work together good country,Bernie Sanders,0
take watch diligently work slander silence anyone speaks ending war financing medicareforall raising minimum wage etc look treated look treating,Bernie Sanders,1
forgot get snapshot time oh well plan another soon medicareforall berniesanders,Bernie Sanders,1
even idiot getting attack bandwagon need take several seat check plan country democraticdebate 2020election,Bernie Sanders,0
holy shit dad voted berniesanders never really talked politics given impression staunch republican fucking proud,Bernie Sanders,1
bernie picking nothing campaign short one moving another candidate bernie major endorsement across south ground game poll number flat south carolina dead campaign double digit trailer,Bernie Sanders,0
democrat precious kind sweet vote war hide behind vote record issue donor democrat get vote time democrat voting berniesanders,Bernie Sanders,1
imagine column amp day high dudgeon would follow bernie ifberniedidit,Bernie Sanders,0
need mirror think vetted source information intensely others information coming cable news lied led nose berniesanders,Bernie Sanders,0
came rally queen saw shouted opposite side stage came hug pretty epic first thing hugged good min called student mom say hello queensbridge park softball field,Bernie Sanders,1
bernie berniesanders rt ttagaris accept normal today grandchild tell u crazy accept trust berniesanders take insurance company drug company alway,Bernie Sanders,1
could get fucking haircut could stop angry time could start vetting right wing jerk seems hire wtf wrong man berniesanders,Bernie Sanders,0
popular presidential candidate child advocate loved youth people conscience power change america bernie right side historyno nra gunviolence marchforourlives,Bernie Sanders,1
fantastic piece finally someone msm clearly fairly outlining difference warren sander fairly light criticism either merely reinforces going vote bernie sander,Bernie Sanders,1
yep like 2016 berniesanders reach black dems 2020 demprimary lostagain claycaneshow claynation,Bernie Sanders,0
know bloomberg supporter one thing really evident way sander warren et al vilifying billionaire lust bankrupt billionaire nasty despicable,Bernie Sanders,1
issue always claim want progressive change bothered learn fact system ignorant system adequately change system hate player hate game bernie,Bernie Sanders,0
bernies policy polarize america also people want change apparently billionaire money make dumb much polarizing,Bernie Sanders,1
parting shot made comparing beto adroit beto appears ashamed comparison endear socialist crowd base support,Bernie Sanders,1
wish would elected 2016 imagine wed wed flattened curve nothing speed bump berniesanders mention change like imagine could happened,Bernie Sanders,1
bernie support marched outside beyond dnc convention security fence robbyantitruth mook pulled stool jakethefake lied lied andlied,Bernie Sanders,1
actually support medicare plan wish vermonter would open eye start seeing bernie economically irresponsible scam artist really vtpoli,Bernie Sanders,0
candidate seriously committed changing thank publicly showing people real world impact policy value medicareforall,Bernie Sanders,1
thread timeline bernie done zip moc still democrat noted outstanding thread nothing civil right nopes,Bernie Sanders,0
terrified apparently campaign received 50k contribution associated debate10k october debate berniesanders,Bernie Sanders,1
personally sick tired someone 3 home book deal ranting rich hypocrite bernie,Bernie Sanders,0
perhaps particular type liberal working network prefer sander unrealistic vision simply worry backlash berniebros allowed moderate wife work sander,Bernie Sanders,0
bernie sander bernie always bernie always bernie always bernie ill let decide good bad answer socialism awesome always like bernie think ill vote still change mind democraticdebate,Bernie Sanders,1
heard reporter houston texasprimary say elizabeth campaign main goal blunting berniesanders rise delegate count amp fundraising nice liz look like working pete bloomberg brokeredconvention fbr,Bernie Sanders,0
behold selfish little snot freeloader looking goody want work believe anyone work becomes rich owe everything one parent berniesanders voter way vote listen cdc,Bernie Sanders,0
bernie say respect obama wanted primaried demdebate democraticdebate,Bernie Sanders,0
forget country club 2m barely get condo palo alto anymore argument bernies wealthy oneoff income surge specious distraction core message social economic justice fall,Bernie Sanders,1
love every time point russian propaganda pissoff bernie supporter,Bernie Sanders,0
globalwarming huge threat rich democrat keep buying home water liar hypocrite scam climatecrisis climatechangehoax climatebully,Bernie Sanders,0
failed bernie bother show ffs wonder would bad president,Bernie Sanders,0
dearbernie canadian genx child young people filled hope included notmeus everything brought dream million heart amazing personality integrity inspires tomorrow leader hope get president,Bernie Sanders,1
one heard bernie one democrat great diverse field candidate democratic platform shape behind win 2020elections,Bernie Sanders,1
completely unbiased politically motivated mueller investigation far caught 13 internet troll dnc rigging bernie fbicorruption come investigation american people deserve answer,Bernie Sanders,1
hispanic stand back 2016 notmeus identity issue best policy uplift u going win,Bernie Sanders,1
let go russian thing big supporter russia berniesanders admired russia much honeymooned 1988 want support lol,Bernie Sanders,1
campaign season already entrenched ageism first victim berniesanders heart issue treated campaign trail yesterday take first victim bernie abort get behind surging soon possible barney,Bernie Sanders,0
matter since sander administration,Bernie Sanders,0
divisiveness last election hell would sander run especially excellent progressive candidate already running person care ego best country trojanhorse bernie,Bernie Sanders,0
people citizen daily say socialism say berniesanders,Bernie Sanders,1
funny would think would head venezuela know since socialism popular,Bernie Sanders,0
voter think berniesanders look unhealthy angry watching tonight wa dermatologist think rosacea releasing record could explain thing,Bernie Sanders,0
2 berniesanders employee paid take back 75 pay benefit bet first fight would slacker get paid hardest worker,Bernie Sanders,0
power individual thank every american opportunity thrive strongly believe institute change america deserves votebluenomatterwho,Bernie Sanders,1
damn free shit would bottom half nation work rest u supposed support understand badmath socialismkills,Bernie Sanders,0
country interferes u election like israel msm point finger russiaaipacisrael berniesanders,Bernie Sanders,0
get notion unreasonable people want detailed medical record 78 year old heart attack month ago berniesanders bernie,Bernie Sanders,0
bernie running dem candidate using dem resource outlet registered democrat yet legitimate candidate democraticdebate democratprimary,Bernie Sanders,0
sorry bernie bit conartist however feel bad supporter get screwed establishment win onepartysystem rigged bernie chronyism 3rdparty corporatemedia fakenews election2020,Bernie Sanders,0
news flash dropping gem interview watch full conversation youtube cardib,Bernie Sanders,1
asking agree green new deal guess candidate protestors rally yesterday know,Bernie Sanders,1
sander owes u medical record hope he okay evident he hiding health vulnerability presidency stressful american people deserve assurance job,Bernie Sanders,0
berners bernie berniesanders hope read learn duped big time hope bernie involved,Bernie Sanders,0
want destroy democratic party bernie bros brought vote diverse woman diverse woman vote bernie get pass time taxreturns,Bernie Sanders,0
take person hillary clinton equation still hate policy stance antibernie crowd really hate policy stance butt hurt refuse bow queen,Bernie Sanders,1
got mom sister vote first time ever brother also friend along parent sister felt good really hope win berniesanders michiganvotes bernie,Bernie Sanders,1
nordic model expanded welfare state provides high level security citizen also successful market economy much freedom pursue dream live life wish need end corporatecommunism berniesanders,Bernie Sanders,1
berniesanders cut chase execute landlord like communist china,Bernie Sanders,0
love bernie campaigned great violation democracy 2016 collapsed hrcs tainted win offered several opportunity lead eschewed dem refused reform still stumm awakes,Bernie Sanders,1
actually correct berniesanders true marxist belief straight communism,Bernie Sanders,0
standwithtulsi iraqwar nomorewars tulsi2024 tulsigabbard opposed hconres55 calling withdrawal u troop iraq syria something core tulsis talk amount integrity comparison bernie none,Bernie Sanders,0
holy shit florida crime caught tape bernie guy someone going jail may agree party vote ever altered election2018,Bernie Sanders,0
progressive embracing super pac newfound vigor look put political influence organizing tactic use aftermath sander capitulation source superpacs uspolitics election2020 campaign democrat looneyleft,Bernie Sanders,0
berniesanders attending aipac prof amp bffs ilhanomar rashidatlaib aoc bigot usa need love americabernie hate america bernie2020 think oklahoma minnesota california arkansas texas,Bernie Sanders,0
two follower get blocked anyone else first fact attorney general cop problem bernie bro keith ellison cuz guess got elected,Bernie Sanders,1
right factory full worker shouting 2a gun another obtuse bernie gif enjoy loss already,Bernie Sanders,0
medium misleading amp tell truth deblasio ny avowed communist sander avowed socialist castro bros obama guy practice repub voter suppression amp medium say nada,Bernie Sanders,0
make skin crawl know clich little like bernie trotting marched mlk thing cringe,Bernie Sanders,0
attention berniebros send hero need another house,Bernie Sanders,0
senator berniesanders b clue potential administration would finance trillion entitlement program ampso disclose plan voter finance b people b bribe vote sell country free stuff,Bernie Sanders,0
telling thing since 2016 go rally busy working ask free anything pay bill go around web bullying people forget bernie,Bernie Sanders,0
fellow berniesanders supporter send kid school wondering bc son turning 5 please comment whether like amp amp w specific type etc please rt amp help get education opinion progressive parent thanks,Bernie Sanders,1
great slogan usual bernie great slogan going cricket,Bernie Sanders,0
cared would postponed primary though sure rigged corporate master favor anyway shame care people profit peopleoverprofits start new party thepeoplesparty begin bernie,Bernie Sanders,1
misogynist spoiled child behaviour showing get grip lost qualified brilliant woman sandersisnotademocrat,Bernie Sanders,0
coronavirus outbreak united state show prove everyone important free healthcare candidate stand behind berniesanders go vote,Bernie Sanders,1
guess changed position medicare candidate always people 4 million individual donor tell done also told gay marriage would never pas bernie,Bernie Sanders,1
former supporter people getting swindled anyone listening horseshit shilling decade decade bernie supporter one fighting working class equality earth two crooked party,Bernie Sanders,1
bernie simply bringing balance political discourse country berniesanders,Bernie Sanders,1
witchtrial house coverup sander amp warren must recuse senate vote directconflictofinterest since running potus seat,Bernie Sanders,0
apologize disgusting remark sen sander well berniesanders,Bernie Sanders,0
seth rich bernie easily topten favorite american time compare sethrich w bernie one got killed defending liberty got lake house look way hisnamewassethrich julianassange wikileaks podesta dws brazile ms13 dnc,Bernie Sanders,0
pretty sure bezos pay personal income taxesof course know bernie never released sure seems like he playing team45 cutthebs,Bernie Sanders,0
anything proudly progressive differentiating bernie feeding basest partisan tribal instinct electorate sound like service self,Bernie Sanders,1
go regurgitating nonsense establishment talking point one fooled except apparently see finish line medicareforall get u welcome signed berniesanders,Bernie Sanders,1
democrat presidential candidate demonstrates little rule law really tcot gop migop,Bernie Sanders,0
issue idiot student take loan problem paying sander want pay stupidity 5200 every man woman child add healthcareforall existing national debt well see make,Bernie Sanders,0
interesting pointedly saying matter kansa nothing bernie kansa 2016 thanks sister,Bernie Sanders,1
bernie one got arrested 1963 actually fighting civil right movement protesting segregation black student chicago berniesanders funfactfriday,Bernie Sanders,1
win election going take u volunteering time energy elect bernie berniesanders,Bernie Sanders,1
rt drdooleymd bernie bros _______________ __ stop erasing woc support policy directly benefit poc bc _ racist notmeus,Bernie Sanders,1
get past perception mild research agree medicareforall bernie,Bernie Sanders,1
start honesty berniesanders considered honest trustworthy consistent throughout career candidate issue truth le compassionate sadly tend vote away progress,Bernie Sanders,1
candidate bet house life back one bernie lyinliz back heartbeat think buying endorsement lyin prego lyin indian heritage etc,Bernie Sanders,1
stopped listening new hip hop around time lilwayne busting eardrum nikki kind pique interest squeaking 2 second except remyma bernie sander quoting card might give chance,Bernie Sanders,1
proud shedding light truly progressive pushing party back left center demdebate2020,Bernie Sanders,1
classism hrc kamala campaign pretty blatant cycle finally illuminate real divide berniesanders,Bernie Sanders,1
nothing free like bernie tell everyone,Bernie Sanders,0
four senator running president get vote ultimate opponent presidency short 10 month must recuse warren klobuchar sander gabbard impeachmentfarce impeachmenthoax,Bernie Sanders,0
true many people color woman member lgbtq community supporter progressive politics like medicareforall campaign,Bernie Sanders,1
agree medicareforall greennewdeal vote transform society society effectively curb worst effect climate change,Bernie Sanders,1
elected servant people grand poo bah corporatedems bernie,Bernie Sanders,1
bernie proving notmeus bunch malarkey seek block formation progressive ticket history spite warren always intellectual superior actual policymaker social justice activist,Bernie Sanders,1
he attacked slighted stronger get go berniesanders dnc,Bernie Sanders,1
warren2020 supporter pushed berniesanders told going,Bernie Sanders,1
communist never follow rule force everyone else bernie,Bernie Sanders,0
got stop making cool bernie vids keep presidentsanders,Bernie Sanders,1
sarah sander say legacy honesty transparencyjust another lie sander quoting lying impotus bos via,Bernie Sanders,1
registered democrat 43 year unapologetically bernie bust remember predlc dems like bernie nobody called socialist bernie fdr dem full stop returning dems fdr root,Bernie Sanders,1
bernie oppo truth keep trying put rest fact staunch hillary advocate bernie critic 2016 privy bernie oppo book also extensive research nothing saw already public record,Bernie Sanders,0
tagged bernie need donation cash app get,Bernie Sanders,1
woman drive insurance industry 60 percent workforce 16 million worker strong bernie going industry mostly woman dominated berniesanders warren2020,Bernie Sanders,1
far left rt raise hand people summit june 2017 4000 u coming take back country nomiddleground bernie,Bernie Sanders,1
